Subject,Topic,Example,Codes,Context,Location
Computer Science,Intro to Software Design,"As software systems have evolved over decades, so too has the approach to performance analysis. Early methodologies were often ad hoc and focused on manual profiling techniques or rudimentary debugging tools. However, with the advent of high-level languages and more sophisticated development environments in the late 20th century, performance analysis began to incorporate automated instrumentation and statistical sampling methods. Today's software engineers benefit from a wealth of advanced analytics platforms that can provide real-time feedback on system efficiency and resource utilization. This historical progression underscores the continuous refinement and integration of performance analysis tools within the software design lifecycle.",HIS,performance_analysis,subsection_end
Computer Science,Intro to Software Design,"To effectively design a software system, it's crucial to understand how mathematical models can predict performance and scalability issues before implementation. By applying probability theory, for example, developers can estimate the likelihood of certain errors occurring under varying loads. This enables them to implement robust error handling mechanisms early in the development cycle, reducing the risk of costly fixes later on. Additionally, using graph theory, one can model the architecture of a system to identify bottlenecks and optimize communication between different components, ensuring that the software remains efficient even as it scales to handle more users or data. This holistic approach not only enhances the reliability of the final product but also streamlines the entire design process by providing clear guidelines based on mathematical principles.",MATH,design_process,paragraph_end
Computer Science,Software Design & Data Structures,"After systematically tracing through the code, you might identify an off-by-one error affecting the performance of a linked list traversal algorithm. This type of issue often stems from incorrect loop conditions or pointer increments that skip elements unintentionally. To resolve it, revisit your algorithm's design principles and ensure each step accurately reflects the intended mathematical operations on indices or offsets within the data structure. For instance, if traversing n nodes in a circular linked list, correctly calculating (i + 1) % n ensures you cycle back to the start after reaching the end, avoiding out-of-bounds errors through precise modulo arithmetic.",MATH,debugging_process,after_example
Computer Science,Software Design & Data Structures,"As we've seen in our exploration of hash tables and collision resolution strategies, each method comes with its own set of trade-offs between space efficiency and performance characteristics. For instance, chaining with linked lists offers simplicity but can lead to inefficient memory usage due to the overhead of storing pointers for each node. On the other hand, open addressing techniques like linear probing or quadratic probing offer better cache utilization by reducing pointer indirection but introduce challenges such as clustering effects which degrade performance under high load conditions. Researchers are continually exploring new methods and hybrid approaches aiming to mitigate these limitations while maintaining optimal average-case complexity. One active area of research involves dynamically adjusting hash table parameters, such as the load factor or resizing thresholds, based on real-time workload analysis to better adapt to varying operational demands.",UNC,integration_discussion,after_example
Computer Science,Intro to Problem-Solving for CS,"In this simulation, you'll explore how problem-solving in computer science evolves through iterative refinement and validation processes. Start by modeling a simple algorithm that sorts data using basic principles like comparison and swapping. As you run the simulation, observe how modifications based on feedback improve efficiency and performance. This iterative approach reflects the dynamic nature of knowledge construction in engineering disciplines, where initial solutions are continuously refined to better meet real-world challenges. Each iteration offers insights into potential improvements, aligning closely with empirical progress in algorithm design and optimization.",EPIS,simulation_description,sidebar
Computer Science,Intro to Problem-Solving for CS,"As we delve deeper into problem-solving strategies in computer science, it's crucial to recognize how these principles intersect with other disciplines like economics and sociology. For instance, when developing algorithms that allocate resources among multiple users, such as bandwidth distribution on a network or scheduling of tasks in cloud computing environments, ethical considerations come to the forefront. Ensuring equitable access while optimizing efficiency demands an understanding of both technical constraints and social impacts. Moreover, adhering to professional standards set by organizations like IEEE ensures that these systems are not only effective but also respectful of user rights and privacy. This interplay between CS problem-solving techniques and societal needs highlights the importance of a multidisciplinary approach in engineering solutions.","PRAC,ETH,INTER",cross_disciplinary_application,paragraph_beginning
Computer Science,Intro to Computer Organization I,"The equation we just derived highlights the importance of understanding how memory addressing works in computer systems, a concept that has evolved significantly since the early days of computing. Historically, as computers became more powerful and complex, the need for efficient memory management became critical. This evolution led to advancements such as virtual memory, paging, and segmentation, which are essential components of modern operating systems. At its core, addressing schemes allow programs to access data stored in physical memory locations without needing to know the exact location, thereby abstracting away the complexities of hardware details from software developers. Understanding these principles is crucial for designing efficient algorithms and optimizing system performance.","HIS,CON",integration_discussion,after_equation
Computer Science,Intro to Computer Organization I,"As we conclude this subsection on memory systems, it's important to consider emerging trends in computer organization that are pushing the boundaries of traditional hardware design. One notable area is the integration of non-volatile memory technologies like Phase-Change Memory (PCM) and Resistive RAM (ReRAM), which offer faster speeds and higher density than current flash solutions. These advancements not only impact storage hierarchy but also influence cache management strategies, requiring engineers to rethink conventional approaches to data handling and retrieval. Additionally, with the rise of machine learning applications, there is a growing interest in designing specialized memory systems optimized for AI workloads, such as processing-in-memory (PIM) architectures that aim to minimize data movement overheads by integrating computation directly within the memory circuitry. As you delve deeper into these topics, remember that staying informed about cutting-edge research and developments is crucial for effective problem-solving and innovation in computer engineering.","META,PRO,EPIS",future_directions,subsection_end
Computer Science,Intro to Computer Organization II,"Recent studies have highlighted the importance of instruction-level parallelism (ILP) in modern processor design, where multiple instructions are executed simultaneously within a single clock cycle. This concept builds upon fundamental principles such as out-of-order execution and speculative execution, which aim to reduce idle time by predicting future instructions based on past behavior patterns. The efficiency gains from these techniques rely heavily on the underlying hardware architecture's ability to manage complex dependencies between instructions, thereby influencing critical performance metrics like throughput and latency. As research continues to explore new frontiers in parallel computing, understanding ILP becomes increasingly crucial for optimizing contemporary computer systems.",CON,literature_review,after_example
Computer Science,Intro to Computer Organization II,"In this worked example, we explored how modern CPUs handle floating-point arithmetic using dedicated hardware like FPU units and SIMD instructions. It's crucial to understand that not all operations can be perfectly represented in binary form, leading to potential rounding errors. As you work through the exercises, consider the implications of these limitations on software reliability and performance. For instance, financial applications requiring high precision might opt for decimal arithmetic over floating-point, adhering to industry standards like IEEE 754 while addressing ethical concerns around data integrity and user trust.","PRAC,ETH,UNC",worked_example,before_exercise
Computer Science,Data Structures and Algorithms,"After applying Dijkstra's algorithm to find the shortest path in a weighted graph, it's essential to consider further optimization processes to enhance computational efficiency. The core theoretical principle here involves recognizing that the standard implementation has a time complexity of O((V+E)logV), where V is the number of vertices and E represents edges. By introducing priority queues with Fibonacci heaps, we can optimize this to O(E + V log V). This improvement not only accelerates the algorithm for graphs with a high edge-to-vertex ratio but also demonstrates an intersection between data structures and algorithms, highlighting how selecting appropriate data structures can significantly influence computational performance.","CON,INTER",optimization_process,after_equation
Computer Science,Data Structures and Algorithms,"The recurrence relation T(n) = 2T(n/2) + Θ(n), which describes the divide-and-conquer approach in algorithms such as merge sort, highlights a fundamental aspect of algorithm design: breaking complex problems into smaller, more manageable subproblems. This strategy not only optimizes computational efficiency but also reflects broader principles of system decomposition and abstraction seen across various engineering disciplines. In network architecture, for instance, large-scale systems are similarly modularized to ensure scalability and maintainability. However, while the divide-and-conquer paradigm is well-established in computer science, its effective application in real-world scenarios often requires careful consideration of boundary conditions and data locality issues, which can significantly impact performance. This ongoing research challenge underscores the need for interdisciplinary collaboration between computer scientists and engineers working on complex systems.","EPIS,UNC",cross_disciplinary_application,after_equation
Computer Science,Computer Systems,"In the design process of computer systems, it's crucial to adhere to professional standards and best practices to ensure reliability and efficiency. For instance, when selecting hardware components, engineers must consider not only performance metrics but also compatibility with existing infrastructure and future upgradeability. This involves conducting thorough market research on current technologies, evaluating their impact based on benchmarks such as power consumption and thermal characteristics. Additionally, ethical considerations come into play during this phase; for example, choosing energy-efficient components to minimize environmental impact aligns with the industry's commitment to sustainability. By integrating these factors early in the design process, engineers can create systems that are not only technically sound but also responsible and forward-thinking.","PRAC,ETH,INTER",design_process,before_exercise
Computer Science,Computer Systems,"As part of the ongoing research into optimizing memory allocation for high-performance computing systems, experimental procedures have been designed to evaluate the impact of different page replacement algorithms on system efficiency and performance under varying workloads. These experiments not only validate existing theoretical models but also reveal new insights into the practical limitations of current memory management techniques. For instance, while the Least Recently Used (LRU) algorithm is widely accepted for its effectiveness in many scenarios, recent studies suggest that it may suffer from issues like Belady's anomaly under certain conditions, highlighting the need for further investigation into adaptive and hybrid approaches.","EPIS,UNC",experimental_procedure,paragraph_end
Computer Science,Professionalism in Computing,"Understanding professional ethics in computing requires a solid grasp of both theoretical principles and practical implications. Core concepts such as confidentiality, integrity, and availability (CIA) triangle are crucial for securing information systems effectively. This framework not only guides the design of secure software but also underscores ethical considerations like data protection laws and privacy policies, which form the legal backbone supporting these principles. For instance, understanding mathematical models that underpin cryptographic algorithms is essential to ensure data integrity and confidentiality, illustrating how theoretical knowledge integrates with practical applications in computing ethics.","CON,MATH",integration_discussion,after_example
Computer Science,Professionalism in Computing,"When comparing the ethical frameworks adopted by software engineers and data scientists, it becomes evident that both professions share a commitment to maintaining professional integrity but approach their responsibilities differently. Software engineers often focus on ensuring the security and reliability of systems they develop, adhering strictly to established best practices and standards. In contrast, data scientists are increasingly concerned with issues such as data privacy and the ethical use of personal information, which requires them to be vigilant about emerging regulatory guidelines and societal expectations. This divergence underscores how professional knowledge evolves in response to specific challenges within each domain.",EPIS,comparison_analysis,paragraph_end
Computer Science,Comparative Languages,"In the debugging process of code written in Python, developers often utilize its built-in pdb module for interactive inspection and troubleshooting. This method aligns with professional engineering standards by promoting systematic error handling and documentation practices. When comparing this approach to Java’s more verbose debugger tools, such as Eclipse's integrated debugger, one notices a significant difference in how each environment supports debugging workflows. Python’s dynamic typing and concise syntax make it easier for developers to quickly identify issues through live code inspection and variable evaluation. On the other hand, Java's static typing and larger scope of variables require more upfront configuration but offer detailed step-through functionality which is crucial for complex enterprise applications. This highlights the importance of understanding language-specific debugging methodologies and their implications on development efficiency and software quality.","PRAC,ETH,INTER",debugging_process,section_middle
Computer Science,Comparative Languages,"Understanding the computational complexity of algorithms written in different languages can provide valuable insights into their performance characteristics. For instance, when analyzing sorting algorithms implemented in Python and Java, we often need to delve into mathematical models that describe their time complexities under various conditions. The Big O notation, a fundamental concept in computer science for expressing algorithm efficiency, plays a crucial role here. When comparing the average-case complexity of QuickSort in Python and its equivalent in Java, one must consider not only the language-specific optimizations but also the underlying data structure manipulations that affect runtime performance. Mathematical analysis reveals that both implementations typically exhibit O(n log n) behavior, highlighting the importance of algorithmic design over language choice when striving for optimal computational efficiency.",MATH,requirements_analysis,subsection_beginning
