Subject,Topic,Example,Codes,Context,Location
Computer Science,Intro to Software Design,"Understanding historical failure modes in software engineering is crucial for developing robust and reliable systems today. One such example is the infamous Y2K problem, which arose from a design oversight that was common practice in early computer programming due to hardware limitations of the time. Programmers often saved space by using two-digit year codes instead of four digits, leading to widespread concern as the millennium approached. This failure highlighted the importance of long-term thinking and the need for standards that anticipate future requirements. As we examine modern software design principles, it's essential to reflect on such historical failures to avoid repeating them in current projects.",HIS,failure_analysis,subsection_beginning
Computer Science,Intro to Software Design,"In the realm of software design, understanding the complexity and efficiency of algorithms is paramount. Consider the problem of sorting a list of n elements using merge sort, an algorithm known for its stability and optimal performance in many scenarios. The recurrence relation that describes the time complexity of merge sort can be derived as T(n) = 2T(n/2) + Θ(n), where T(n) represents the number of operations required to sort a list with n elements.<br><br>Starting from this recurrence, we apply the Master Theorem for divide-and-conquer algorithms. According to Case 1 of the theorem, since the work done at each level of recursion is linear (Θ(n)), and the problem size is halved at every step, the total number of operations can be approximated by T(n) = Θ(n log n).<br><br>This derivation not only demonstrates the efficiency of merge sort but also provides a foundational understanding of how to analyze recursive algorithms mathematically. Such analyses are crucial for software designers aiming to optimize performance and resource usage in their applications.","CON,MATH,PRO",mathematical_derivation,subsection_middle
Computer Science,Software Design & Data Structures,"After reviewing Figure 3.4, which illustrates the trade-offs between different data structures for implementing a priority queue, it's evident that choosing the right data structure is crucial to achieving optimal performance in software applications. This selection process involves understanding not only theoretical concepts but also practical considerations such as memory constraints and real-time requirements. To approach this problem systematically, first identify the key operations of your application (e.g., insertions, deletions, accessing elements) and their frequency. Next, evaluate how each data structure would perform these operations based on their time complexities. For example, a binary heap is efficient for both insertions and deletions in O(log n), while a linked list might offer simpler implementation but suffer from O(n) performance for deletion of the maximum element. This meta-analysis of trade-offs helps you make an informed decision that balances theoretical efficiency with practical constraints.","META,PRO,EPIS",problem_solving,after_figure
Computer Science,Software Design & Data Structures,"In designing efficient software systems, understanding the core theoretical principles of data structures and algorithms is crucial. Consider a scenario where you are tasked with optimizing a program that frequently searches for elements within large datasets. One effective approach involves utilizing hash tables due to their average constant-time complexity for search operations. A hash table works on the principle of mapping keys directly to indexes in an array using a hash function, thereby reducing lookup times significantly compared to linear or binary search methods. However, it's important to recognize that hash collisions can degrade performance if not managed properly through techniques like chaining or open addressing. Current research focuses on developing collision resolution strategies that maintain high efficiency while minimizing space overhead, highlighting the ongoing debate and limitations in this area.","CON,UNC",worked_example,sidebar
Computer Science,Intro to Problem-Solving for CS,"To solve a complex algorithmic problem, such as finding the shortest path in a weighted graph, one must construct knowledge through iterative refinement and validation of hypotheses. This process often begins by identifying and applying well-established algorithms like Dijkstra's or A*, which have been rigorously tested over decades to ensure their correctness under various conditions. However, it is crucial to recognize that while these algorithms are robust for most cases, they may not be optimal in all scenarios due to the evolving nature of computational requirements and hardware capabilities. For instance, in real-time systems where speed is paramount, research into novel heuristic functions or parallel processing techniques becomes necessary to improve performance without sacrificing accuracy. Such ongoing exploration highlights the dynamic interplay between theoretical foundations and practical needs in computer science problem-solving.","EPIS,UNC",worked_example,paragraph_beginning
Computer Science,Intro to Problem-Solving for CS,"In computer science, problem-solving often involves iterative refinement of algorithms based on empirical testing and theoretical validation. For instance, when developing a sorting algorithm, initial prototypes may not be efficient or robust enough to handle edge cases such as large datasets with duplicate values. Engineers must continuously test these implementations against established benchmarks like Big O notation to validate their performance. Moreover, the evolving nature of computing hardware requires algorithms that can adapt and optimize resource usage efficiently. Current research focuses on developing adaptive sorting techniques that can dynamically adjust based on real-time system conditions, pushing the boundaries of traditional algorithm design paradigms.","EPIS,UNC",practical_application,subsection_beginning
Computer Science,Intro to Computer Organization I,"This section introduces hands-on laboratory exercises designed to deepen understanding of computer architecture fundamentals covered in previous chapters. Each lab session will focus on specific aspects of CPU design, memory management, and instruction set architectures using industry-standard tools such as the Intel HEX format for loading binary code into microprocessors. Students will work with hardware simulators like Logisim or online platforms like Codebender to implement and debug assembly language programs on simulated 8085 processors. These experiments reinforce theoretical knowledge by providing practical insights into how computer systems function at a low level, adhering to professional standards for documenting and presenting experimental results.",PRAC,experimental_procedure,section_beginning
Computer Science,Intro to Computer Organization I,"When designing a computer system, it's essential to understand the trade-offs between memory capacity and access speed. While increasing memory capacity can store more data and support larger programs, this often comes at the cost of higher latency as newer types of memory such as NAND flash or DRAM have slower access times compared to traditional SRAM used in CPU caches. Conversely, opting for faster but smaller memory solutions like L1 cache enhances performance but limits storage capabilities. As an engineer, it's crucial to balance these factors by considering the specific requirements and constraints of your project—such as whether I/O operations are more frequent or if real-time processing is a priority—to ensure optimal system design.",META,trade_off_analysis,paragraph_beginning
Computer Science,Intro to Computer Organization II,"In the context of computer memory management, consider a scenario where an application requires frequent access to large datasets that do not fit into main memory (RAM). This situation necessitates effective use of virtual memory techniques. To address this issue, let's analyze a step-by-step method for optimizing page replacement algorithms such as Least Recently Used (LRU) and Not Recently Used (NRU), focusing on reducing the number of page faults and minimizing the overhead incurred by swapping pages between main and secondary storage.

First, implement a system to track the access patterns of data segments. Utilize counters or timestamps for each page in memory. When a page fault occurs, apply the LRU algorithm to select a victim page based on least recent access time. This requires updating timestamp counters upon each page access and comparing them during eviction.

Moreover, consider integrating NRU with LRU by categorizing pages into multiple usage classes according to their activity levels over different time intervals, thus providing finer control over page replacement decisions without significantly increasing complexity.","PRO,META",scenario_analysis,section_end
Computer Science,Intro to Computer Organization II,"Before diving into the optimization exercises for cache memory, it's important to understand how knowledge in this area is constructed and validated through rigorous experimentation and theoretical validation. Researchers continually refine our understanding of optimal cache strategies by analyzing real-world performance data against simulation models. For instance, the MESI (Modified, Exclusive, Shared, Invalid) protocol has evolved over time based on empirical studies that highlight its effectiveness in reducing memory access latency. However, there are still ongoing debates about the best approach for multi-core systems where contention can significantly impact cache efficiency. As you work through these exercises, consider how theoretical models might differ from practical implementations and explore potential optimizations beyond traditional methodologies.","EPIS,UNC",optimization_process,before_exercise
Computer Science,Data Structures and Algorithms,"In the realm of network routing, efficient pathfinding algorithms are crucial for minimizing latency and ensuring optimal data transmission. Consider the case study of a large-scale enterprise network where routers must process millions of packets per second to maintain system integrity. By employing Dijkstra's shortest path algorithm as the core routing protocol, engineers can dynamically calculate the most efficient routes between nodes in real-time. The step-by-step application of this algorithm involves initializing all node distances except for the starting point, which is set to zero. Subsequently, the nearest unvisited vertex is selected and its neighboring vertices are updated with tentative distance values based on the current path length plus the edge weight to that neighbor. This process iterates until all nodes have been visited or no more updates can be made, effectively mapping out the shortest paths from a given source node throughout the network topology.",PRO,case_study,paragraph_beginning
Computer Science,Data Structures and Algorithms,"In the realm of data structures, the choice between hash tables and binary search trees (BSTs) for implementing a dictionary data type is often determined by specific use case requirements. Hash tables offer constant-time average complexity for insertion, deletion, and lookup operations, making them ideal for scenarios where performance is critical, such as real-time systems or large-scale web applications. Conversely, BSTs provide ordered data storage that allows efficient range queries and dynamic updates, which are essential in environments like databases or file systems requiring frequent sorting and searching tasks. The evolving landscape of computer science continues to explore hybrid structures like Splay trees and hash-based dictionaries to leverage the strengths of both approaches while mitigating their limitations, reflecting an ongoing research trend towards more adaptive data structures.","EPIS,UNC",comparison_analysis,paragraph_end
Computer Science,Computer Systems,"In designing computer systems, engineers often face trade-offs between performance and energy efficiency. For instance, incorporating high-performance processors can significantly boost computational speed, but they also consume more power and generate more heat, which may require additional cooling solutions to maintain system reliability. This decision not only impacts the physical design of a device but also raises ethical considerations such as the environmental impact of increased energy consumption and potential waste generation from frequent hardware upgrades. Interdisciplinary connections between computer science and electrical engineering are crucial here, as understanding both software optimization techniques and the thermal dynamics involved in system cooling is necessary to achieve balanced designs that meet user needs without compromising on sustainability.","PRAC,ETH,INTER",trade_off_analysis,paragraph_beginning
Computer Science,Computer Systems,"In recent years, there has been a growing interest in the development of neuromorphic computing systems, which are designed to mimic the structure and function of biological neural networks. These systems aim to overcome the limitations of traditional von Neumann architectures, such as the bottleneck between memory and processing units, by integrating both functions on the same chip. Despite significant progress, several challenges remain unresolved. For instance, the design of energy-efficient synaptic circuits that can scale up to billions of neurons remains an open research area. Moreover, there is ongoing debate about how best to represent and process information in these systems, with some researchers advocating for spiking neural networks due to their biological plausibility, while others favor rate-based models due to computational simplicity. These limitations highlight the need for interdisciplinary collaboration between computer scientists, neuroscientists, and materials scientists to push the boundaries of neuromorphic computing.",UNC,literature_review,subsection_middle
Computer Science,Professionalism in Computing,"In analyzing a failure incident where a software system experienced unexpected downtime due to a rare combination of user inputs, it is crucial to adopt a systematic approach to understanding and addressing the issue. The process begins with collecting comprehensive logs and error reports which provide initial insights into the sequence of events leading up to the failure. Next, a thorough examination of the system's architecture reveals potential design weaknesses that could have contributed to the vulnerability. This includes assessing the robustness of input validation mechanisms, data handling processes, and error recovery strategies.

Using this information, we apply root cause analysis techniques such as the Five Whys or Fishbone Diagrams to identify the underlying causes rather than just addressing surface-level symptoms. Once identified, these causes are evaluated against industry best practices for software development and maintenance, highlighting any gaps in current methodologies or standards that need improvement.

Ultimately, the failure provides an opportunity not only to correct the immediate issue but also to implement broader changes in organizational culture, emphasizing proactive risk assessment and continuous learning from incidents. Such a comprehensive approach enhances professionalism within computing by fostering accountability, transparency, and a commitment to excellence.",PRO,failure_analysis,section_end
Computer Science,Professionalism in Computing,"As computing technology continues to advance, emerging trends such as ethical AI and transparent algorithmic decision-making are becoming critical components of professional practice in computing. Future engineers must navigate the complexities of developing systems that not only perform tasks efficiently but also adhere to stringent ethical standards. This includes ensuring that algorithms do not perpetuate bias or discrimination, a challenge that requires interdisciplinary collaboration with ethicists, sociologists, and legal experts. For instance, implementing transparent AI can involve creating detailed logs of decision-making processes for accountability and reducing opacity in automated systems used by governments and corporations. Moreover, the professional community is increasingly emphasizing the importance of lifelong learning to stay updated on these evolving standards, ensuring that technology development aligns with societal values and ethical considerations.","PRAC,ETH,INTER",future_directions,after_example
Computer Science,Comparative Languages,"In the context of comparative programming languages, understanding how different paradigms handle control flow and data manipulation is crucial. For instance, in functional languages like Haskell, immutability ensures that variables are never reassigned once declared, which simplifies debugging and allows for better parallel processing capabilities due to a lack of shared mutable state. In contrast, imperative languages such as C++ allow direct modification of memory addresses through pointers, offering more flexibility but also increasing the risk of bugs related to concurrency and data integrity issues. This fundamental difference in approach reflects core theoretical principles that underpin the design and implementation of these languages, highlighting how language choice can significantly impact program efficiency and maintainability.",CON,algorithm_description,subsection_middle
Computer Science,Comparative Languages,"Figure 2 shows a comparison of garbage collection strategies between Java and C++. In failure analysis, it's crucial to understand how different languages handle memory management. Meta-knowledge for this topic includes understanding the implications of automatic vs manual memory management on software reliability and performance. For example, while Java’s garbage collector simplifies memory management by automatically reclaiming unused objects, leading to fewer programmer errors related to memory leaks or dangling pointers, it can introduce unpredictable pauses in application execution. In contrast, C++ offers fine-grained control over memory allocation through pointers but requires rigorous adherence to best practices to avoid common pitfalls such as use-after-free errors and double-frees. Understanding these trade-offs is essential for engineers selecting a language that aligns with their project's performance requirements and operational constraints.","META,PRO,EPIS",failure_analysis,after_figure
